id,state_code,name,level,type,refundable,max_amount,tax_year,short_description,long_description,source_url
dc_schedule_h,DC,Schedule H — Homeowner/Renter Property Tax Credit,state,credit,TRUE,1425,2025,Property tax relief for low-to-moderate income DC residents who rent or own,Refundable credit based on property tax paid (or rent paid to landlord) compared to income. Often called the DC HRPTC. Can be claimed standalone.,https://otr.cfo.dc.gov/page/individual-income-tax-forms
dc_kcca,DC,Keep Child Care Affordable Credit,state,credit,TRUE,1200,2025,Refundable credit for child care expenses per eligible child,Capped at $1200 per eligible child for tax year 2025. Child must be born between Oct 1 2021 and Dec 31 2025 and claimed as a dependent.,https://otr.cfo.dc.gov/page/individual-filings-faqs
dc_eitc,DC,DC Earned Income Tax Credit,state,credit,TRUE,8046,2025,DC matches 100% of federal EITC for tax year 2025,For tax year 2025 DC EITC equals 100% of the federal EITC. Investment income must be under $11950.,https://otr.cfo.dc.gov/
dc_senior_property,DC,Senior Citizen / Disabled Property Owner Tax Relief,state,deduction,FALSE,,2025,50% reduction in property tax for qualifying seniors or disabled homeowners,Reduces property tax by 50%. Owner must be 65+ or certified disabled with at least 50% ownership and reside in property.,https://otr.cfo.dc.gov/
dc_homestead,DC,Homestead Deduction,state,deduction,FALSE,,2025,Deducts a fixed amount from property assessment for primary residence,Reduces taxable assessment of owner-occupied primary residence. Application required.,https://otr.cfo.dc.gov/
va_eitc_refundable,VA,Refundable Virginia Earned Income Tax Credit,state,credit,TRUE,,2025,20% of federal EITC refundable for full-year VA residents,Refundable credit equal to 20% of federal EITC (increased from 15% starting 2025). Cannot also claim CLI or non-refundable VA EITC.,https://www.tax.virginia.gov/low-income-individuals-credit
va_eitc_nonref,VA,Non-Refundable Virginia EITC,state,credit,FALSE,,2025,20% of federal EITC as nonrefundable alternative,Non-refundable credit equal to 20% of federal EITC. Cannot exceed tax liability.,https://www.tax.virginia.gov/low-income-individuals-credit
va_cli,VA,Credit for Low-Income Individuals (CLI),state,credit,FALSE,300,2025,$300 per personal/dependent exemption for VA filers below federal poverty,VAGI must be below federal poverty guidelines. Up to $300 per personal or dependent exemption.,https://www.tax.virginia.gov/low-income-individuals-credit
va_osc,VA,Credit for Taxes Paid to Another State,state,credit,FALSE,,2025,Avoids double taxation when working across state lines,For VA residents whose income was also taxed by another state. Reciprocity with KY DC MD WV PA.,https://www.tax.virginia.gov/credit-for-taxes-paid-to-another-state
va_livable_home,VA,Livable Home Tax Credit,state,credit,FALSE,6500,2025,Credit for accessibility improvements to a primary residence,Up to $6500 for purchasing/retrofitting a residence with universal accessibility features.,https://www.tax.virginia.gov/livable-home-tax-credit
md_eitc_refundable,MD,Refundable Maryland EITC,state,credit,TRUE,4000,2025,Up to 45% of federal EITC for childless / 28% with children,MD residents who qualify for federal EITC also qualify. ITIN filers and childless adults under 25 also eligible.,https://www.marylandcomptroller.gov/individuals/eitc.html
md_eitc_nonref,MD,Non-Refundable Maryland EITC,state,credit,FALSE,,2025,Equal to 50% of federal EITC applied first,Non-refundable component applied before refundable portion.,https://www.marylandcomptroller.gov/individuals/eitc.html
md_poverty,MD,Maryland Poverty Level Credit,state,credit,FALSE,,2025,Eliminates state tax for filers below federal poverty,Eliminates state tax liability for taxpayers with income at or below federal poverty guidelines.,https://marylandtaxes.gov/tax-credits.php
md_ctc,MD,Maryland Child Tax Credit,state,credit,TRUE,500,2025,Up to $500 per qualifying child for low-income families,State CTC up to $500 per qualifying child for families meeting income thresholds.,https://marylandtaxes.gov/tax-credits.php
md_homeowner_property,MD,Homeowners' Property Tax Credit (HTC),state,credit,FALSE,,2025,Property tax relief for homeowners with combined income under $60K,Combined gross household income cannot exceed $60000. Net worth excluding home/retirement under $200K.,https://onestop.md.gov/forms/homeowners-property-tax-credit-application-form-htc-2026-697398ca87824f0196b84220
md_student_loan,MD,Student Loan Debt Relief Tax Credit,state,credit,FALSE,5000,2025,Up to $5K for borrowers via competitive application,Competitive credit awarded by Maryland Higher Education Commission. Up to $5000 for qualifying student loan borrowers.,https://marylandtaxes.gov/tax-credits.php
ca_caleitc,CA,California Earned Income Tax Credit (CalEITC),state,credit,TRUE,3756,2025,Up to $3756 for low-income working Californians,Earned income $1-$32900 to qualify. SSN or ITIN OK. Must live in CA more than half the year.,https://www.ftb.ca.gov/file/personal/credits/caleitc/index.html
ca_yctc,CA,Young Child Tax Credit (YCTC),state,credit,TRUE,1189,2025,$1189 per return for CalEITC families with child under 6,Must qualify for CalEITC and have qualifying child under 6 at end of tax year.,https://www.ftb.ca.gov/file/personal/credits/young-child-tax-credit.html
ca_fytc,CA,Foster Youth Tax Credit (FYTC),state,credit,TRUE,1189,2025,$1189 per qualifying former foster youth,Ages 18-25 who were in CA foster care at age 13+. Up to $2378 if both spouses qualify.,https://www.ftb.ca.gov/file/personal/credits/caleitc/eligibility-and-credit-information.html
ca_renters,CA,California Renter's Credit,state,credit,FALSE,120,2025,Nonrefundable credit for eligible CA renters,$60 single / $120 MFJ. Must have rented CA residence more than half the year.,https://www.ftb.ca.gov/
ca_cdcc,CA,California Child and Dependent Care Expenses Credit,state,credit,FALSE,,2025,State version of federal Child and Dependent Care Credit,Calculated under CA-specific rules and limitations.,https://www.ftb.ca.gov/
ny_eitc,NY,NY State Earned Income Credit,state,credit,TRUE,,2025,30% of federal EITC for NY residents,Refundable credit equal to 30% of federal EITC. Combined with federal can be worth thousands.,https://www.tax.ny.gov/pit/credits/income_tax_credits.htm
ny_empire_child,NY,Empire State Child Credit,state,credit,TRUE,1000,2025,$1000/child under 4 or $330/child age 4-16,Substantially enhanced for 2025. Decoupled from federal CTC. Full-year NY residents only.,https://www.tax.ny.gov/pit/credits/empire_state_child_credit.htm
ny_real_property,NY,NY Real Property Tax Credit,state,credit,TRUE,,2025,Property tax relief for NY homeowners and renters,Refundable credit. Home market value under $85K. Renters: avg monthly rent $450 or less.,https://otda.ny.gov/workingfamilies/taxcredits.asp
ny_college_tuition,NY,NY College Tuition Credit,state,credit,FALSE,400,2025,Up to $400 per eligible student for tuition,For full-year NY residents who paid qualified college tuition.,https://www.tax.ny.gov/pit/credits/income_tax_credits.htm
ny_long_term_care,NY,NY Long-Term Care Insurance Credit,state,credit,FALSE,,2025,20% of qualifying long-term care insurance premiums,Eligible for 20% of premiums paid for qualifying long-term care insurance policy.,https://www.tax.ny.gov/pit/credits/income_tax_credits.htm
il_eitc,IL,Illinois Earned Income Tax Credit,state,credit,TRUE,1646,2025,20% of federal EITC for IL residents,Refundable. ITIN filers and ages 18-24/65+ without dependents also eligible.,https://tax.illinois.gov/programs/eitc.html
il_ctc,IL,Illinois Child Tax Credit,state,credit,TRUE,,2025,40% of IL EITC for families with child under 12,New for 2025 (increased from 20% to 40% of IL EITC).,https://tax.illinois.gov/programs/eitc.html
il_property_credit,IL,Illinois Property Tax Credit,state,credit,FALSE,,2025,5% of IL property tax paid on principal residence,Non-refundable. Income limits under $250K single / $500K MFJ.,https://tax.illinois.gov/
ma_eitc,MA,Massachusetts EITC,state,credit,TRUE,,2025,40% of federal EITC for MA residents,Refundable. One of highest state EITC matches at 40% of federal credit.,https://www.mass.gov/info-details/massachusetts-earned-income-tax-credit-eitc
ma_ctc,MA,Massachusetts Child and Family Tax Credit,state,credit,TRUE,440,2025,$440 per qualifying dependent (child under 13 or disabled/senior),Refundable. $440 per qualifying dependent. No cap on number.,https://www.mass.gov/
ma_circuit_breaker,MA,Senior Circuit Breaker Tax Credit,state,credit,TRUE,2730,2025,Property tax/rent relief for MA seniors 65+,Up to $2730 for seniors whose property tax (or 25% of rent) exceeds 10% of income.,https://www.mass.gov/
ma_renters,MA,Massachusetts Rental Deduction,state,deduction,FALSE,4000,2025,Up to $4000 deduction for rent paid on MA primary residence,Deduction equal to 50% of rent paid up to $4000.,https://www.mass.gov/
wa_wftc,WA,Washington Working Families Tax Credit,state,credit,TRUE,1330,2025,Modeled after federal EITC up to $1330,Up to $1330 depending on number of qualifying children. WA has no income tax. ITIN OK.,https://workingfamiliescredit.wa.gov/eligibility
co_eitc,CO,Colorado Earned Income Tax Credit (COEITC),state,credit,TRUE,4023,2025,50% of federal EITC for CO residents (TY 2025),Up to ~50% of federal EITC for tax year 2025. ITIN filers and ages 18-24 also eligible.,https://tax.colorado.gov/income-tax-topics-earned-income-tax-credit
co_ctc,CO,Colorado Child Tax Credit (COCTC),state,credit,TRUE,1200,2025,Up to $1200 per qualifying child under 6,10-60% of federal CTC depending on income. For children under 6.,https://tax.colorado.gov/ctc-eitc
co_factc,CO,Colorado Family Affordability Tax Credit (FATC),state,credit,TRUE,3200,2025,Up to $3200 per child under 6 / $2400 per child under 17,New credit for CO families. Phases out as income rises ($95K cutoff).,https://tax.colorado.gov/ctc-eitc
co_ptc,CO,Colorado Property Tax/Rent/Heat Rebate,state,credit,TRUE,,2025,State rebate for seniors/disabled with limited income,Helps cover property tax rent and heating costs. 65+ or surviving spouse 58+ or disabled.,https://tax.colorado.gov/PTC-rebate
nj_eitc,NJ,New Jersey Earned Income Tax Credit (NJEITC),state,credit,TRUE,,2025,40% of federal EITC for NJ residents,One of highest state EITC matches at 40%. Age floor lowered to 21+. ITIN filers eligible.,https://www.nj.gov/treasury/taxation/eitc/
nj_ctc,NJ,New Jersey Child Tax Credit,state,credit,TRUE,1000,2025,Up to $1000 per qualifying child under 6,Refundable credit for families earning $80K or less with child under 6.,https://www.nj.gov/treasury/taxation/
nj_property_tax,NJ,New Jersey Property Tax Deduction/Credit,state,credit,FALSE,50,2025,$50 credit OR deduction up to $15K of property tax paid,Choose deduction up to $15K of property taxes (or 18% of rent) OR a $50 refundable credit.,https://www.nj.gov/treasury/taxation/
nj_anchor,NJ,ANCHOR Property Tax Relief,state,credit,TRUE,1750,2025,Property tax/rent relief for homeowners and renters,Up to $1750 for homeowners 65+ ($1500 for under 65) and $700 for renters. Income-based.,https://www.nj.gov/treasury/taxation/anchor/
pa_forgiveness,PA,Pennsylvania Tax Forgiveness Credit,state,credit,FALSE,,2025,Eliminates or reduces PA income tax for low-income filers,Reduces or eliminates PA personal income tax for eligible low-income filers. Family-size based.,https://www.pa.gov/agencies/revenue/forms-and-publications/pa-personal-income-tax-guide/tax-forgiveness
pa_ptrr,PA,Property Tax/Rent Rebate (PTRR),state,credit,TRUE,1000,2025,Up to $1000 rebate for seniors/disabled on property tax or rent,Eligible: 65+ widows/widowers 50+ or disabled 18+. Income limit $48110.,https://www.pa.gov/agencies/revenue/ptrr
pa_wptc,PA,Working Pennsylvanians Tax Credit (WPTC),state,credit,TRUE,,2025,New refundable EITC at 10% of federal credit (TY 2026),New for tax year 2026. Refundable credit at 10% of federal EITC.,https://www.pa.gov/agencies/revenue/
or_eitc,OR,Oregon Earned Income Tax Credit,state,credit,TRUE,,2025,9% of federal EITC (12% if child under 3),Refundable. 9% of federal EITC for most filers. Boosted to 12% for families with children under 3.,https://www.oregon.gov/dor/programs/individuals/Pages/credits.aspx
or_ctc,OR,Oregon Kids' Credit,state,credit,TRUE,1000,2025,Up to $1000 per child under 5 for low-income families,Refundable credit for OR families with children under 5. Phases out around $30K income.,https://www.oregon.gov/dor/programs/individuals/Pages/credits.aspx
or_wfhdc,OR,Oregon Working Family Household and Dependent Care Credit,state,credit,TRUE,,2025,Refundable credit for child/dependent care expenses,For working families with care expenses. Refundable. Income-based.,https://www.oregon.gov/dor/programs/individuals/Pages/credits.aspx
mn_wfc,MN,Minnesota Working Family Credit,state,credit,TRUE,,2025,~37% of federal EITC for MN residents,State EITC equivalent at roughly 37% of federal credit. Refundable.,https://www.revenue.state.mn.us/
mn_ctc,MN,Minnesota Child Tax Credit,state,credit,TRUE,1750,2025,$1750 per qualifying child (most generous in US),Most generous state CTC in the country at $1750 per qualifying child. Refundable.,https://www.revenue.state.mn.us/
mn_property_refund,MN,Minnesota Property Tax Refund,state,credit,TRUE,3500,2025,Property tax refund for homeowners and renters,Up to $3500 for homeowners and ~$2570 for renters. Income-based.,https://www.revenue.state.mn.us/property-tax-refund
mn_renters,MN,Minnesota Renter's Property Tax Refund,state,credit,TRUE,2570,2025,Refund for renters whose rent funded property tax,Refundable. For MN renters whose 17% of rent (deemed property tax) exceeds threshold.,https://www.revenue.state.mn.us/
ga_low_income,GA,Georgia Low-Income Tax Credit,state,credit,FALSE,,2025,Tax credit for GA filers with federal AGI under $20K,Non-refundable credit. Federal AGI under $20000.,https://dor.georgia.gov/
ga_ctc,GA,Georgia Child Tax Credit,state,credit,FALSE,250,2025,$250 per child non-refundable (TY 2026),New for tax year 2026. $250 per qualifying child.,https://dor.georgia.gov/
ga_education,GA,Georgia Qualified Education Expense Credit,state,credit,FALSE,,2025,Credit for contributions to Student Scholarship Organizations,Donations to SSOs may be claimed as a credit. Pre-approval required.,https://dor.georgia.gov/
nc_ctc_dependent,NC,North Carolina Credit for Children,state,deduction,FALSE,,2025,Deduction up to $2500 per qualifying child,Deduction (not credit) up to $2500 per qualifying child for NC filers meeting income limits.,https://www.ncdor.gov/
nc_property_homestead,NC,NC Property Tax Homestead Exclusion,state,deduction,FALSE,,2025,Property tax exclusion for elderly/disabled,For NC residents 65+ or totally disabled. Excludes greater of $25K or 50% of home's value.,https://www.ncdor.gov/
mi_eitc,MI,Michigan Earned Income Tax Credit,state,credit,TRUE,2349,2025,30% of federal EITC for MI residents,Refundable. Increased from 6% to 30% in 2023.,https://www.michigan.gov/taxes/iit/eitc
mi_homestead,MI,Michigan Homestead Property Tax Credit,state,credit,TRUE,1700,2025,Property tax credit for owners and renters,Up to $1700. Total household resources under $71500. For MI homeowners and renters.,https://www.michigan.gov/taxes
mi_home_heating,MI,Michigan Home Heating Credit,state,credit,TRUE,,2025,Help with heating costs for low-income households,Refundable credit for MI residents to offset heating costs. Income-based.,https://www.michigan.gov/taxes
az_dependent,AZ,Arizona Dependent Tax Credit,state,credit,FALSE,100,2025,$100 per dependent under 17 / $25 per dependent 17+,Non-refundable. Phases out at higher incomes.,https://azdor.gov/
az_property_credit,AZ,Arizona Property Tax Refund Credit,state,credit,TRUE,502,2025,Refundable credit for AZ seniors with property tax,Up to $502. For AZ residents 65+ with limited income.,https://azdor.gov/
az_charitable,AZ,Arizona Charitable Tax Credit,state,credit,FALSE,938,2025,Dollar-for-dollar credit for donations to qualifying charities,Up to $470 single / $938 MFJ for donations to Qualifying Charitable Organizations.,https://azdor.gov/
oh_eitc,OH,Ohio Earned Income Tax Credit,state,credit,FALSE,,2025,30% of federal EITC (non-refundable) for OH residents,Non-refundable Ohio EITC at 30% of federal credit.,https://tax.ohio.gov/
oh_ctc,OH,Ohio Child Tax Credit (proposed),state,credit,TRUE,1000,2025,Up to $1000 per child under 6 (pending legislation),Proposed; not yet enacted as of late 2025.,https://tax.ohio.gov/
oh_homestead,OH,Ohio Homestead Exemption,state,deduction,FALSE,,2025,Property tax reduction for elderly/disabled homeowners,Reduces property tax by exempting up to $26200 of home value. 65+ or permanently disabled.,https://tax.ohio.gov/
ct_eitc,CT,Connecticut Earned Income Tax Credit,state,credit,TRUE,,2025,40% of federal EITC + $250 for families with kids,Refundable. Connecticut EITC is 40% of federal + additional $250 for households with dependents.,https://portal.ct.gov/drs
ct_property,CT,Connecticut Property Tax Credit,state,credit,FALSE,300,2025,Up to $300 credit for property tax on primary residence,Non-refundable. For CT homeowners. Income limits apply.,https://portal.ct.gov/drs
ct_ctc,CT,Connecticut Child Tax Rebate,state,credit,TRUE,750,2025,$250 per child up to 3 children,Refundable rebate. Income limits.,https://portal.ct.gov/drs
hi_eitc,HI,Hawaii Earned Income Tax Credit,state,credit,TRUE,,2025,40% of federal EITC for HI residents,Refundable Hawaii EITC at 40% of federal credit.,https://tax.hawaii.gov/
hi_food,HI,Hawaii Refundable Food/Excise Tax Credit,state,credit,TRUE,330,2025,Up to $330 per exemption to offset food/excise tax,Refundable. Helps offset general excise tax on food. Per exemption claimed.,https://tax.hawaii.gov/
hi_low_income,HI,Hawaii Low-Income Household Renters Credit,state,credit,FALSE,50,2025,$50 credit for low-income HI renters,For HI residents earning less than $30K who pay rent.,https://tax.hawaii.gov/
in_eitc,IN,Indiana Earned Income Tax Credit,state,credit,TRUE,,2025,10% of federal EITC for IN residents,Refundable Indiana EITC at 10% of federal credit.,https://www.in.gov/dor/
in_unified_elderly,IN,Indiana Unified Tax Credit for the Elderly,state,credit,FALSE,140,2025,Up to $140 for IN seniors with limited income,For IN residents 65+ with low federal AGI ($10K single / $19K MFJ).,https://www.in.gov/dor/
in_renters,IN,Indiana Renter's Deduction,state,deduction,FALSE,3000,2025,Up to $3000 deduction for IN renters,Deduct up to $3000 of rent paid on primary IN residence.,https://www.in.gov/dor/
ks_eitc,KS,Kansas Earned Income Tax Credit,state,credit,TRUE,,2025,17% of federal EITC for KS residents,Refundable Kansas EITC at 17% of federal credit.,https://www.ksrevenue.gov/
ks_food,KS,Kansas Food Sales Tax Credit,state,credit,FALSE,,2025,Refundable credit for low-income KS residents to offset food tax,For KS residents 55+ or with dependents under 18 OR disabled. Income limit ~$30K.,https://www.ksrevenue.gov/
me_eitc,ME,Maine Earned Income Tax Credit,state,credit,TRUE,,2025,50% of federal EITC childless / 25% with children,Refundable. Maine has highest match for childless workers at 50% of federal credit. ITIN filers eligible.,https://www.maine.gov/revenue/
me_property_fairness,ME,Maine Property Tax Fairness Credit,state,credit,TRUE,1500,2025,Up to $1500 property tax/rent relief for ME residents,Refundable. For ME homeowners and renters with limited income.,https://www.maine.gov/revenue/
me_dep_exemption,ME,Maine Dependent Exemption Tax Credit,state,credit,FALSE,300,2025,$300 credit per qualifying child under 17,Non-refundable credit per qualifying dependent. Phases out at higher incomes.,https://www.maine.gov/revenue/
mo_eitc,MO,Missouri Working Family Credit,state,credit,FALSE,,2025,10% of federal EITC (non-refundable) for MO residents,Non-refundable. Cannot exceed tax liability.,https://dor.mo.gov/
mo_property,MO,Missouri Property Tax Credit (Circuit Breaker),state,credit,TRUE,750,2025,Property tax/rent credit for MO seniors and disabled,Up to $1100 for homeowners or $750 for renters. 65+ or 100% disabled. Income limit ~$30K-$34K.,https://dor.mo.gov/
mt_eitc,MT,Montana Earned Income Tax Credit,state,credit,TRUE,,2025,20% of federal EITC for MT residents (doubled in 2025),Refundable. Doubled from 10% to 20% in 2025.,https://mtrevenue.gov/
mt_elderly,MT,Montana Elderly Homeowner/Renter Credit,state,credit,TRUE,1150,2025,Up to $1150 for MT seniors with property tax/rent,Refundable. For MT residents 62+ with income under $45K.,https://mtrevenue.gov/
ne_eitc,NE,Nebraska Earned Income Tax Credit,state,credit,TRUE,,2025,10% of federal EITC for NE residents,Refundable Nebraska EITC at 10% of federal credit.,https://revenue.nebraska.gov/
ne_property,NE,Nebraska Property Tax Credit,state,credit,FALSE,,2025,Refundable credit for school property taxes paid,For NE homeowners. Based on school district property tax paid.,https://revenue.nebraska.gov/
nm_eitc,NM,New Mexico Working Families Tax Credit,state,credit,TRUE,,2025,25% of federal EITC for NM residents,Refundable. NM Working Families Tax Credit at 25% of federal EITC. ITIN filers eligible.,https://www.tax.newmexico.gov/
nm_low_income,NM,New Mexico Low-Income Comprehensive Tax Rebate,state,credit,TRUE,730,2025,Refundable rebate for low-income NM residents,Up to $730 depending on income and exemptions.,https://www.tax.newmexico.gov/
nm_property,NM,New Mexico Property Tax Rebate,state,credit,TRUE,250,2025,For NM seniors with limited income,Refundable. For NM residents 65+ with income under $16K.,https://www.tax.newmexico.gov/
ok_eitc,OK,Oklahoma Earned Income Tax Credit,state,credit,TRUE,,2025,5% of federal EITC for OK residents,Refundable Oklahoma EITC at 5% of federal credit.,https://oklahoma.gov/tax.html
ok_sales_tax,OK,Oklahoma Sales Tax Relief Credit,state,credit,TRUE,40,2025,$40 per exemption to offset sales tax for low-income OK residents,Refundable. Income limit $20K single / $50K with dependents.,https://oklahoma.gov/tax.html
ri_eitc,RI,Rhode Island Earned Income Tax Credit,state,credit,TRUE,,2025,16% of federal EITC for RI residents,Refundable. Increased from 15% in 2024 to 16% in 2025.,https://tax.ri.gov/
ri_property,RI,Rhode Island Property Tax Relief,state,credit,TRUE,675,2025,Property tax/rent credit for RI seniors and disabled,Refundable. For RI residents 65+ or disabled with income under $35K.,https://tax.ri.gov/
sc_eitc,SC,South Carolina Earned Income Tax Credit,state,credit,FALSE,,2025,125% of federal EITC (non-refundable) for SC residents,Non-refundable. Highest match in country at 125% but non-refundable so most filers get little benefit.,https://dor.sc.gov/
sc_two_wage,SC,South Carolina Two Wage Earner Credit,state,credit,FALSE,350,2025,$350 credit for married couples both working,Non-refundable. Helps reduce marriage penalty.,https://dor.sc.gov/
ut_ctc,UT,Utah Child Tax Credit,state,credit,FALSE,1000,2025,Up to $1000 per child under 5,Non-refundable. Increased eligible age to under 6 starting 2025. Income-based phase out.,https://tax.utah.gov/
ut_retirement,UT,Utah Retirement Tax Credit,state,credit,FALSE,450,2025,Credit for UT retirees with limited income,Up to $450 per qualifying taxpayer 65+. Income limits apply.,https://tax.utah.gov/
vt_eitc,VT,Vermont Earned Income Tax Credit,state,credit,TRUE,,2025,38% of federal EITC for VT (100% for childless),Refundable. 38% with children / 100% for workers without children (raised 2025).,https://tax.vermont.gov/
vt_ctc,VT,Vermont Child Tax Credit,state,credit,TRUE,1000,2025,$1000 per child under 7 for VT residents,Refundable. Expanded from under 6 to under 7 starting 2025. Phases out above $125K income.,https://tax.vermont.gov/
vt_renter,VT,Vermont Renter Credit,state,credit,TRUE,,2025,Renter's credit based on income and rent paid,Refundable. For VT renters with limited income.,https://tax.vermont.gov/
wv_lif,WV,West Virginia Low-Income Family Credit,state,credit,FALSE,,2025,Reduces WV income tax for very low-income filers,Non-refundable. Income limits depend on family size.,https://tax.wv.gov/
wv_homestead,WV,West Virginia Senior Citizen Tax Credit,state,credit,TRUE,,2025,Property tax credit for WV seniors,Refundable. For WV homeowners 65+.,https://tax.wv.gov/
wi_eitc,WI,Wisconsin Earned Income Tax Credit,state,credit,TRUE,,2025,4-34% of federal EITC depending on # children,Refundable. 4% with 1 child / 11% with 2 / 34% with 3+ children. No credit for childless workers.,https://www.revenue.wi.gov/
wi_homestead,WI,Wisconsin Homestead Credit,state,credit,TRUE,1168,2025,Property tax/rent credit for low-income WI residents,Refundable. Up to $1168 for WI homeowners and renters with income under $24680.,https://www.revenue.wi.gov/
ia_eitc,IA,Iowa Earned Income Tax Credit,state,credit,TRUE,,2025,15% of federal EITC for IA residents,Refundable Iowa EITC at 15% of federal credit.,https://tax.iowa.gov/
ia_tuition,IA,Iowa Tuition and Textbook Credit,state,credit,FALSE,500,2025,$500 per dependent for K-12 education expenses,Non-refundable. For IA parents paying K-12 education expenses.,https://tax.iowa.gov/
de_eitc,DE,Delaware Earned Income Tax Credit,state,credit,partial,,2025,Choose 4.5% refundable OR 20% non-refundable,Delaware allows filers to choose between a 4.5% refundable credit or 20% non-refundable credit.,https://revenue.delaware.gov/
ky_family,KY,Kentucky Family Size Tax Credit,state,credit,FALSE,,2025,Reduces KY tax for low-income families,Non-refundable. Based on family size and federal poverty thresholds.,https://revenue.ky.gov/
la_eitc,LA,Louisiana Earned Income Tax Credit,state,credit,TRUE,,2025,5% of federal EITC for LA residents,Refundable Louisiana EITC at 5% of federal credit.,https://revenue.louisiana.gov/
nh_education,NH,New Hampshire Education Credit,state,credit,FALSE,,2025,Limited credits as NH has no general income tax,NH does not have general income tax on wages. No EITC.,https://www.revenue.nh.gov/
