id,state_code,name,level,type,refundable,max_amount,tax_year,short_description,long_description,source_url
ms_no_state,MS,Mississippi (No state EITC),state,credit,FALSE,,2025,MS does not currently offer state-level EITC,No state EITC. Standard federal credits only.,https://www.dor.ms.gov/
ar_no_state,AR,Arkansas (No state EITC),state,credit,FALSE,,2025,AR does not offer state-level EITC,No state EITC. Property tax homestead credit available.,https://www.dfa.arkansas.gov/
al_no_state,AL,Alabama (No state EITC),state,credit,FALSE,,2025,AL does not offer state-level EITC,No state EITC.,https://www.revenue.alabama.gov/
nd_eitc,ND,North Dakota Earned Income Tax Credit,state,credit,TRUE,,2025,Limited state credits — federal credits primary,ND has flat tax with limited state-level credits.,https://www.tax.nd.gov/
sd_no_tax,SD,South Dakota (No income tax),state,credit,FALSE,,2025,SD has no state income tax,No state EITC or income tax.,https://dor.sd.gov/
ak_pfd,AK,Alaska Permanent Fund Dividend,state,credit,TRUE,,2025,Annual dividend (not a tax credit) but unique to AK,Annual dividend paid to AK residents (not technically tax credit). $1700+ per resident in 2024.,https://pfd.alaska.gov/
nv_no_tax,NV,Nevada (No income tax),state,credit,FALSE,,2025,NV has no state income tax,No state EITC or income tax.,https://tax.nv.gov/
tn_no_tax,TN,Tennessee (No income tax),state,credit,FALSE,,2025,TN has no state income tax (Hall income tax repealed 2021),No state EITC.,https://www.tn.gov/revenue.html
wy_no_tax,WY,Wyoming (No income tax),state,credit,FALSE,,2025,WY has no state income tax,No state EITC or income tax.,https://revenue.wyo.gov/
id_grocery,ID,Idaho Grocery Credit,state,credit,FALSE,135,2025,$135 per person to offset grocery sales tax,Non-refundable for most filers. ID is one of few states that taxes groceries.,https://tax.idaho.gov/
federal_eitc,US,Earned Income Tax Credit (EITC),federal,credit,TRUE,8046,2025,Federal credit for low-to-moderate income workers and families,Refundable federal credit. Maximum $8046 with 3+ qualifying children. Investment income limit $11950.,https://www.irs.gov/credits-deductions/individuals/earned-income-tax-credit
federal_ctc,US,Child Tax Credit (CTC),federal,credit,partial,2000,2025,Per-child federal credit up to $1700 refundable as ACTC,Up to $2000 per qualifying child under 17. Refundable portion up to $1700.,https://www.irs.gov/credits-deductions/individuals/child-tax-credit
federal_aotc,US,American Opportunity Tax Credit (AOTC),federal,credit,partial,2500,2025,Up to $2500 per student for first 4 years of post-secondary education,40% refundable (up to $1000). Half-time student in degree program.,https://www.irs.gov/credits-deductions/individuals/aotc
federal_llc,US,Lifetime Learning Credit (LLC),federal,credit,FALSE,2000,2025,Up to $2000 per return for qualified education expenses,Non-refundable. No limit on years claimed.,https://www.irs.gov/credits-deductions/individuals/llc
federal_savers,US,Saver's Credit,federal,credit,FALSE,1000,2025,Credit for contributions to retirement accounts,10%/20%/50% of contributions up to $2000 ($4000 MFJ). Income-limited.,https://www.irs.gov/retirement-plans/plan-participant-employee/retirement-savings-contributions-savers-credit
federal_premium,US,Premium Tax Credit,federal,credit,TRUE,,2025,Helps offset health insurance premiums from Marketplace,Refundable. For coverage purchased through Health Insurance Marketplace.,https://www.irs.gov/affordable-care-act/individuals-and-families/the-premium-tax-credit-the-basics
federal_cdcc,US,Child and Dependent Care Credit,federal,credit,FALSE,1050,2025,Credit for child care or dependent care expenses,Up to 35% of $3000 (1 dependent) or $6000 (2+) in care expenses.,https://www.irs.gov/credits-deductions/individuals/child-and-dependent-care-credit
